Word,Definition
abacus,Frame with balls for calculating       
abase,"Degrade or humble; to lower in rank, status, or esteem"
abate,"Reduce, diminish; To lessen to subside        "
abdicate,Formally give up the throne (or some other power or responsibility)
abdication,Giving up control authority        
aberrant,"Abnormal, deviant"
aberration,Straying away from what is normal      
abet,Help/encourage smb (in doing wrong)     
abeyance,"Temporary suspension, inactivity; Suspended action          "
abhor,"Detest, regard with disgust; To hate to detest        "
abide,Be faithful to endure        
abjure,"Give up, renounce; repudiate, recant, or shun (especially formally or under oath); Promise or swear to give up      "
abraded,Rubbed off worn away by friction      
abrasive,"Rough, suitable for grinding or polishing (such as sandpaper); causing irritation or annoyance"
abreast,"Side-by-side. the more common ""abreast of"" means keeping up with, staying aware of, or remaining equal in progress with."
abridge,Reduce or lessen; shorten by omitting parts throughout while retaining the main idea
abrogate,Repeal or annul by authority       
abscission ,"Cutting off; sudden termination; the separation of leaves, petals, or other parts from a plant or animal"
abscond,Depart suddenly and secretively; To go away suddenly (to avoid arrest)     
abstain,"Hold back, refrain (especially from something bad or unhealthy); decline to vote"
abstruse,Difficult to comprehend obscure        
abut,Border on          
abysmal,Bottomless extreme          
abyss,A deep and vast space or cavity; anything profound or infinite
acarpous,Effete no longer fertile worn out      
accede,"Agree, give consent; assume power (usually as ""accede to"")"
acclaimed,Welcomed with shouts and approval       
accolade,Praise approval          
accretion,The growing of separate things into one     ; Gradual increase; an added part or addition
acerbic,Sour; harsh or severe
acidulous   ,Slightly acid or sour; sharp or caustic
acme,"Summit, peak, highest point"
activism,"The practice of pursuing political or other goals through vigorous action, often including protests and demonstrations"
acumen,"Keen, quick, accurate insight or judgment"
adamant,Kind of stone inflexible        
adhere,"Stick (to), such as with glue, or to a plan or belief"
admonish ,"Mildly scold; caution, advise, or remind to do something"
admonitory,Containing warning          
adorn,Add beauty decorate         
adulterate ,Make impure by adding inappropriate or inferior ingredients
adulteration,Making unpure poorer in quality       
adumbrate ,Give a rough outline of; foreshadow; reveal only partially; obscure
adverse,"Opposing, harmful"
advocate    ,Speak or argue in favor of (verb); a person who pleads for a cause or on behalf of another person (noun)
aerie    ,"Dwelling or fortress built on a high place; the nest of a bird of prey, such as an eagle or hawk, built on a mountain or cliff"
aesthetic    ,"Concerning the appreciation of beauty or good taste, pertaining to the science of what is beautiful (adj); a sense of beauty and taste of a particular time and place (noun)"
affable,Polite and friendly       
affable    ,"Warm and friendly, pleasant, approachable"
affectation    ,Fake behavior (such as in speech or dress) adopted to give a certain impression
affinity,Close connection relationship         
aggrandize    ,Make greater; exaggerate
aggravate,Make worse irritate         
aggregate    ,"Gather together, amount to (verb); constituting a whole made up of constituent parts (adj)"
agile,Active quick-moving          
agog,Eager/excited         
ail,Trouble be ill         
alacrity,Eager and cheerful readiness        
alacrity    ,Cheerful or speedy willingness
albeit    ,"Although, even though"
alcove,Recess/partially enclosed place       
alienate    ,"Cause to become unfriendly, hostile, or distant"
allegiance,Duty support loyalty         
alleviate,Make (pain) easier to bear       
alleviate    ,"Lessen, make easier to endure"
alloy,To debase by mixing with something inferior     
aloof,Reserved indifferent          
aloof    ,Distant physically or emotionally; reserved; indifferent
amalgamate,Mix combine unite societies        
amalgamate      ,"Blend, merge, or unite"
ambidextrous,Able to use the left hand or the right equally well 
ambiguous,Doubtful uncertain          
ambiguous    ,"Not clear, hard to understand, open to having several meanings or interpretations"
ambivalent,Having both of two contrary meanings      
ambivalent    ,"Uncertain; unable to decide, or wanting to do two contradictory things at once"
ameliorate,Improve make better         
ameliorate    ,Improve; make better or more bearable
amortize,End (a debt) by setting aside money     
amortize    ,"Gradually pay off a debt, or gradually write off an asset"
anachronism     ,"Something that is not in its correct historical time; a mistake in chronology, such as by assigning a person or event to the wrong time period"
analgesia    ,Pain relief; inability to feel pain
analogous    ,"Comparable, corresponding in some particular way (making a good analogy)"
anarchy    ,"Absence of law or government; chaos, disorder"
anguish,Severe suffering        
animosity,Strong dislike          
annul    ,"Make void or null, cancel, abolish (usually of laws or other established rules)"
anodyne,"Medicine that relieves pain (noun); soothing, relieving pain (adj)"
anoint,"Rub or sprinkle oil on; make sacred, such as by a ceremony that includes applying oil to someone"
anomaly,Deviation from what is common; inconsistency
antagonize,Make hostile or unfriendly
antedate,"Be older than, precede in time; assign to an earlier date"
antidote,Medicine used against a poison or a disease    
antithetical,Direct opposing          
antithetical ,"Directly opposed, opposite; involving antithesis (the rhetorical act of placing two phrases opposite one another for contrast, as in love me or hate me)"
apartheid,Brutal racial discrimination         
apathy,Not caring; absence of feeling; lack of interest or concern
aplomb,Self-confidence           
apocryphal   ,Of questionable authenticity; false
apostate,"One who abandons long-held religious or political convictions    ; Person who deserts a party, cause, religion, etc."
apostle,"Pioneer of a reform movement (originally, an early follower of jesus)"
apotheosis,Deification glorification to godliness        
appease,Make quiet or calm        
apposite,"Highly appropriate, suitable, or relevant"
apprehensive,Grasping understanding fear unhappy feeling about future     
apprise,"Inform, give notice to; Give notice to inform        "
approbation,"Praise or approval, especially formal approval; Approval           "
appropriate ,Set aside or authorize (such as money) for a particular purpose; take for one's own use
apropos,Appropriate to the situation apt       
apt,Well-suited quick-witted          
arabesque,A complex ornate design        
arbiter,"Judge, umpire, person empowered to decide matters at hand"
arboreal,Of connected with trees        
arcane,"Known or understood by only a few; obscure, secret"
archaic,"Characteristic of an earlier period, ancient, primitive"
ardent,"Very passionate, devoted, or enthusiastic"
ardor,Enthusiasm           
arduous,"Steep difficult ascent laborious        ; Very difficult, strenuous; severe, hard to endure"
argot,Jargon slang          
arrant,In the highest degree        
arrogance,Proud superior manner of behaviour       
arrogate,Claim or take presumptuously or without the right to do so
articulate,"Speak distinctly connect by joints       ; Using language in a clear, fluent way (adj); speak distinctly or give clarity to an idea (verb)"
artifact,"Any object made by humans, especially those from an earlier time, such as those excavated by archaeologists"
artless,"Free of deceit or craftiness, natural, genuine; lacking skill or knowledge, crude, uncultured"
ascend,Go or come up        
ascertain,Find out with certainty; Get to know         
ascetic,"Abstinent or austere in lifestyle (adj); a person who leads an austere and simple life without material pleasures, esp. someone who does this for religious reasons; Practicing self-denial austere stark        "
ascribe,Consider to be the origin of or belonging to   ; Assign or credit to a certain cause or source
aseptic,Surgically clean        
aseptic    ,Free from germs
asperity,Roughness harshness ill temper irritability       
asperity    ,"Rigor, severity; harshness or sharpness of tone; roughness of surface"
aspersion,Slander           
aspersions       ,"Damaging remarks, defamation, slander"
assail,With attack violently         
assail    ,"Attack violently, assault"
assiduous,Diligent hard-working sedulous         
assiduous    ,"Persevering, diligent, constant"
assuage,Make smth (pain desire) less       
assuage    ,"Make milder, relieve; soothe, pacify, or calm"
asterisk,The mark * (e.g.. omitted letters)      
astringent,Substance that shrinks         
astute,Clever quick at seeing to get an advantage    
atonement,Repayment death of jesus        
attenuate,Make thin. weaken enervate        
attenuate    ,Weaken or thin out
attune,Bring into harmony       
attuned    ,In harmony; in sympathetic relationship
audacious,Daring foolishly bold impudent        
audacious    ,"Very bold or brave, often in a rude or reckless way; extremely original"
augment    ,Make larger
augury,Omen sign          
augury    ,"Telling the future, such as through supernatural means"
august,Majestic venerable          
august    ,"Venerable, majestic; inspiring admiration"
auspicious,Favorable successful prosperous         
austere,Severely moral and strict simple and plain     
austere    ,"Severe in manner or appearance; very self-disciplined, ascetic; without luxury or ease; sober or serious"
autonomous   ,"Self-governing, independent"
auxiliary,Helping supporting          
avarice    ,Insatiable greed; a miserly desire to hoard wealth
aver,Affirm assert prove justify        
aver    ,Declare or affirm with confidence
aversion,Strong dislike          
avid,Eager greedy          
avid    ,"Enthusiastic, dedicated, passionate; excessively desirous"
avow,Admit. declare openly         
axiom    ,Self-evident truth requiring no proof; universally or generally accepted principle
baleful,Harmful ominous causing evil        
balk,Obstacle purposely to get on the way of    
balk    ,Refuse to proceed or to do something
balloon    ,Swell or puff out; increase rapidly
banal    ,Lacking freshness and originality; cliché
bane    ,Something that ruins or spoils
baneful,Causing harm or ruin pernicious destructive      
barrage,Artificial obstacle built across a river      
barren,Not good enough unable to have young ones without value  
base    ,"Morally low, mean, dishonorable; of little or no value; crude and unrefined; counterfeit"
bask,In enjoy warmth and light       
baying    ,"Howling in a deep way, like a dog or wolf"
beatify,To bless make happy or ascribe a virtue to   
bedizen,To adorn especially in a cheap showy manner    
belabor,Beat hard        
belie    ,Contradict or misrepresent
bellicose,Belligerent pugnacious warlike         
belligerent,(person nation) waging war        
benefactor,Person who has given help       
beneficent    ,Doing good
benevolence,Wish or activity in doing good      
benign,Kind and gentle mild (climate)       
benign    ,"Harmless; favorable; kindly, gentle, or beneficial; not cancerous"
bent    ,Personal inclination or tendency
bequest,Arrangement to give smth at death      
berate,Scold sharply          
bereft,Rob or dispossess of smth (material)      
besiege    ,"Attack, overwhelm, crowd in on or surround"
bevy    ,Group of birds or other animals that stay close together; any large group
bewilder,Puzzle confuse          
bifurcate    ,To fork into two branches or divide into two halves
bigot,Stubborn narrow-minded person         
bilge,Bulge the protuberance of a cask      
bilk,Cheat or defraud
blandishment,Flattery coaxing          
blandness,Polite manner comforting uninteresting        
blatant,Noisy and rough         
blight,"Disease that kills plants rapidly, or any cause of decay or destruction (noun); ruin or cause to wither (verb)"
blithe,"Cheerful casual carefree         ; Joyous, merry; excessively carefree (so as to ignore more important concerns)"
bogus,"Sham counterfeit not genuine        ; Fake, fraudulent"
boisterous,Loud noisy rough lacking restraint       
bolster,Give greatly needed support        ; Strengthen or support
bombastic,(of speech or writing) far too showy or dramatic than is appropriate; pretentious
bonhomie,"Friendliness, open and simple good heartedness"
boor,"Rude, ill-mannered, or insensitive person; a peasant or country bumpkin"
boorish,Crude offensive rude         
brandish,"Shake, wave, or flourish, as a weapon"
brash,Hasty rush cheeky saucy        
brass,Yellow metal (mixing copper and zinc)      
brazen,Made of brass         
breach,Opening broken place breaking        
brittle,Easily broken          
broach,Bring up announce begin to talk about     
brook,Suffer or tolerate; To tolerate endure         
bucolic,Pertaining to shepherds; suggesting a peaceful and pleasant view of rural life
buffer,"Something that shields, protects, absorbs shock, or cushions"
buoyant,Able to float light-hearted        
bureaucracy ,"Government characterized by many bureaus and petty administrators or by excessive, seemingly meaningless requirements"
burgeon,Grow or flourish rapidly; put forth buds or shoots (of a plant); Grow forth send out buds       
burnish,"Polish, make smooth and lustrous; To polish rub to a shine      "
buttress,"Support or encourage (verb); a support or prop, esp. projecting from and supporting the wall of a building (noun)"
bygone,"Past, former (adj); that which is in the past (usually plural noun)"
cabal,A scheme or plot a group of plotters    
cacophony,"Harsh, discordant, or meaningless mixture of sounds"
cadge,To beg to get by begging      
cajole,Use flattery or deceit to persuade    
calipers,Metal supports attached to the legs measuring instrument    
calumny,Malicious lie intended to hurt someone's reputation; the act of telling such lies; Slander aspersion          
canard,"Rumor, a false or baseless story"
candid,"Open, sincere, honest; Frank straight-forward          "
canonical,"Authorized, recognized; pertaining to the canon, or body of accepted rules, standards or artistic works"
cant,Insincere talk/jargon        
cantankerous,Bad-tempered/quarrelsome         
canvass,Discuss thoroughly sort of touting       
capricious,"Acting on impulse, erratic"
cardinal,"Chief, most important"
cartography   ,Mapmaking
castigate,Criticize severely; punish in order to correct; To chastise correct by punishing       
castigation,Severe punishment          
catalyst,Substance that causes speeding up       ; Causer of change
catholic    ,"Universal, broad-minded"
caustic,Biting sarcastic          
caustic    ,Capable of corroding metal or burning the skin; very critical or sarcastic
censure,Expression of blame or disapproval a rebuke     
censure    ,Strong disapproval or official reprimand (noun); to issue such disapproval or reprimand (verb)
centurion,Leader of a unit of 100 soldiers     
chary,Cautious wary          
chastened,Corrected punished          
chastisement,Punishment           
chauvinism    ,"Fanatical patriotism or blind enthusiasm for military glory; undue or biased devotion to any group, cause, etc."
chauvinist,A blindly devoted patriot        
chicanery,Legal trickery/false argument       
chicanery    ,"Trickery, deception by knowingly false arguments"
chisel,Steel tool for shaping materials       
chronological    ,Arranged in or relating to time order
churl,Bad-tempered person          
circumscribe    ,"Strictly limit a role, range of activity, or area; in math, to be constructed around so as to touch as many points as possible"
circumspect    ,"Cautious, prudent; careful to consider the circumstances and consequences"
clamber    ,"Climb awkwardly or with difficulty, scramble"
clamor,Shout complain with a lot of noise     
clamor    ,"Noisy uproar or protest, as from a crowd; a loud, continuous noise"
clientele,Customers         
clinch,Come to grips/settle conclusively      
clinch    ,Make final or settle conclusively; to fasten or hold together
cling,To resist separation         
clot,Half-solid lump formed from liquid       
cloture,Closing device (in parliament) to end a debate by voting  
cloying    ,Disgustingly or distastefully sweet
coagulate    ,Cause a liquid to become solid or semisolid
coagulation,Change to a thick and solid state   
coalesce    ,"Come together, unite; fuse together"
coalescing,Coming together and uniting into one substance     
coax,Get smb to do smth by kindness     
coda,Passage that completes a piece of music   
coda    ,"Final part of a musical composition; an ending, esp. one that sums up what has come before"
coddle,Treat with care and tenderness       
coerce,Compel to force to make obedient      
coeval,Of the same period coexisting       
coffer    ,"Chest for storing valuables; financial resources, a treasury"
cogent,Strong convincing          
cogent    ,"Very convincing, logical"
cogitate,Think deeply mediate         
cognizant,Being fully aware of        
colander,Bowl-shaped vessel with many holes used to drain off water  
collude    ,Conspire; cooperate for illegal or fraudulent purposes
collusion,Secret agreement for a deceitful purpose      
combustion,Process of burning         
commemorate,Keep the memory of        
commensurate     ,"The same in size, extent, etc., equivalent; proportional"
commodious,Having plenty of space for what is needed  
commuter,Person who travels regularly        
compendium    ,Concise but complete summary; a list or collection
complacent    ,"Self-satisfied, smug; overly content (and therefore lazy, neglectful, or some other bad quality)"
complaisance,Tending to comply obliging willingness to please     
complaisant,Eager to please; cheerfully complying
complementary,Completing; fitting together well; filling mutual needs
compliant,"Obeying, submissive; following the requirements"
compunction,Feeling of regret for one's action      
conceal,Hide keep secret         
concede,"Give in, admit, yield; acknowledge reluctantly; grant or give up (such as giving up land after losing a war)"
conceit,Over-high opinion of too much pride      
conciliatory,"Reconciling, appeasing, attempting to make the peace; Reconciling soothing comforting mollifying        "
concord,Agreement or harmony         
concur,"Agree in opinion happen together       ; Approve, agree"
condense,Increase in density strength make laconic      
condone,"Forgive           ; Overlook, tolerate, regard as harmless"
confer,"Consult, compare views; bestow or give"
confound,"Confuse, frustrate; mix up or make worse"
congeal,Make or become stiff and solid      
conjoin,To join together         
connoisseur,"A person with good judgement (e.g.. in art)    ; Expert, especially in the fine arts; person of educated, refined tastes"
connotation,Suggestion in addition to        
connote,"Suggest or imply in addition to the precise, literal meaning"
consequential,Pompous self important         
console,"Give comfort or sympathy to       ; Lessen the suffering or grief of (verb); a control panel, or small table or cabinet (noun)"
consolidate,"Unite, combine, solidify, make coherent"
conspicuous,Easily seen remarkable         
consternation,Surprise and fear dismay        
constrain,Compel         
constrict,"Squeeze, compress; restrict the freedom of; Make tight or smaller        "
construe,Interpret or translate
consume,Get to the end of       
consummate,Perfect/make perfect/complete        
contemn,To scorn or despise        
contentious,"Controversial; prone to causing arguments, especially gratuitous or petty ones; Argumentative pugnacious combative quarrelsome        "
contextualize ,"Place in context, such as by giving the background or circumstances"
contiguous,Touching neighboring near         
contraries,Things that are opposing; either of two opposite things
contrite,Remorseful; feeling sorry for one's offenses or sins; Filled with deep sorrow for wrongdoing      
contumacious,Insubordinate rebellious          
contumacious ,Rebellious; stubbornly disobedient
conundrum,"A riddle dilemma enigma        ; Riddle, the answer to which involves a play on words; any mystery"
converge,Move towards one another or towards a point; unite
conversant,Knowledgeable about or experienced with
conversely,In an opposite way; on the other hand
conviction,Convincing firm belief         
convoke,"Call together, as to a meeting; Call together summon         "
convoluted,Twisted; very complicated; Complicated coiled twisted         
copious,"Plentiful, bountiful"
cordial,Warm and sincere         
cordon,Line (of police acting as a guard)     
cornucopia,Abundant supply        
corporeal,Physical of or for the body      
correlate,Have a mutual relation        
corroborate,"Support, add evidence to"
corroboration,Additional strengthening evidence         
cosmopolitan ,"Belonging to the entire world, at home globally; free from local or national prejudices or attachments"
cosset,"Treat as a pet, pamper"
coterie,"Close or exclusive group, clique"
countenance,To favor or approve of       
countenance ,Facial expression or face (noun); approve or tolerate (verb)
counterfeit,Forgery           
counterintuitive,Against what one would intuitively expect
counterpoint,"Contrasting item, opposite; a complement; the use of contrast or interplay in a work of art"
counterproductive,Defeating the purpose; preventing the intended goal
countervail,Counterbalance           
covert,"Secret, veiled, undercover; Disguised           "
covetous,Eagerly desirous          
cower,Crouch shrink back         
coy,Shy/modest (esp of a girl)     
crafty,"Cunning, skillful in deception or underhanded schemes"
crass,Very great (es. stupidity)      
cravat,Piece of linen worn as a necktie   
craven,"Cowardly           ; Very cowardly, lacking courage"
crease,Line made by crushing white line on the ground in cricket 
credibility,"Believability, trustworthiness"
credulity,Too great a readiness to believe things     
credulous,Gullible; prone to believing or trusting too easily or without enough evidence; Ready to believe things        
crescendo,"Steady increase in force, intensity, or the loudness of a musical passage; a climactic moment or peak"
crush,Press lose shape subdue overwhelm       
cryptic,Secret with a hidden meaning       
culminate,Reach the highest point or final stage
cumbersome,Burdensome heavy and awkward to carry      
cupidity,"Greed, great or excessive desire"
curmudgeon,"Bad-tempered person          ; Bad-tempered, difficult person; grouch"
curriculum,Course of study         
cursory,Quick hurried          
curtail,Make shorter then was planned       
cynical,Thinking the worst of others' motivations; bitterly pessimistic
dainty,Pretty/delicate(food)/difficult to please       
daunt,"Intimidate make fearful         ; Discourage, dishearten, lessen the courage of"
dawdler,Person who is slow waste of time     
dearth,Shortage           
debacle,A breakup overthrow sudden disaster       
debase,"Degrade; lower in quality, value, rank, etc.; lower in moral quality"
debunk,"Expose, ridicule, or disprove false or exaggerated claims"
declaim,"Speak in an impassioned, pompous, or oratorical manner; give a formal speech"
declivity,Downward slope
decorous,Behaving with propriety and good taste; polite
decorum,Propriety properness          
decree,Order given by authority        
decry,Disapprove of          
deem,Judge; consider
deface,"Vandalize, mar the appearance of"
default,"Failure to act, neglect (noun); fail to fulfill an obligation, especially a financial one (verb)"
defer,Postpone give way (to show respect)      
deference,Respectful submission; yielding to the authority or opinion of another
deferential,Showing respect          
defiance,Open disobedience or resistance        
deflect,"Cause to curve; turn aside, esp. from a straight course; avoid"
deleterious,"Harmful, unhealthful"
delimit,"Fix, mark, or define the boundaries of"
delineate,To portray depict sketch out       ; Mark the outline of; sketch; describe in detail
deluge,Great flood heavy rush of water      
demagogue,Person appealing not to reasons       
demagogue ,A leader who lies and gains power by arousing the passions and especially prejudices of the people
demur,"Show reluctance or object, especially for moral reasons; To hesitate raise objections        "
denigrate,"Belittle, attack the reputation of; Blacken belittle sully defame        "
denote,Be a name or symbol for
denouement,An outcome or solution the unraveling of a plot   
deplete,Use until none remains        
deposition,Dethronement depositing          
deprave,Make morally bad corrupt        
deprecate,Protest against express disapproval of       
dereliction,Deserting and leaving to fall into ruins     
deride,"Mock, scoff at, laugh at contemptuously"
derision,Ridicule mockery deriding         
derivative,Unoriginal obtained from another source       ; Derived from something else; not original
derogatory,Insulting tending to damage        
descry,Catch sight of see smth in the distance    
desiccant,Substance used to absorb moisture       
desiccate,"Thoroughly dried up, dehydrated"
desuetude,Cessation of use disuse        
desultory,"Lacking consistency or order, disconnected, sporadic; going off topic; Aimless haphazard digressing at random       "
detached,"Impartial, disinterested; unconcerned, distant, aloof"
deter,Discourage hinder          
deterrent,Something that restrains or discourages
detraction,Slandering verbal attack aspersion        
