Word,Definition
detumescence,Diminishing or lessening of swelling       
deviance,Being different in moral standards (from normal)     
dexterity,Skill (esp. in handling)        
diaphanous,Transparent gauzy          
diaphanous   ,"Very sheer, fine, translucent"
diatribe,"Bitter, abusive attack or criticism; rant; Bitter and violent attack in words      "
dichotomy,Division into two parts or into two contradictory groups
dictum,Formal or authoritative pronouncement; saying or proverb
didactic,"Intended to instruct; teaching, or teaching a moral lesson"
diffidence,Shyness           
diffident,"Lacking confidence, shy"
diffuse,"Spread widely, disseminate (verb); dispersed, widely spread out, or wordy and going off- topic (adj)"
digress,Go off-topic when speaking or writing
dilate,"Speak comprehensively become wider large       ; To become wider or make wider, cause to expand; to speak or write at length, elaborate upon"
dilatory,"Slow, late; procrastinating or stalling for time"
dilettante,Person who takes up an art or activity for amusement only or in a superficial way
din,"Loud, confused noise, esp. for a long period of time"
dirge,A funeral or mourning song or poem
disabuse,Free someone from a mistake in thinking
disallow,Refuse to allow or accept as a correct    
discern,See with an effort but clearly      
discerning,Having good judgment or insight; able to distinguish mentally
discomfit,Confuse embarrass          
discomfiting ,"Disconcerting, confusing, frustrating"
disconcert,Upset the self-possession of        
discordant,"Harsh or inharmonious in sound; disagreeing, incongruous"
discountenance,Refuse to approve of        
discourse,Speech lecture          
discredit,"Injure the reputation of, destroy credibility of or confidence in; Refuse to believe         "
discreet,Careful/prudent         
discrepancy,Difference or inconsistency
discrete,"Separate, distinct, detached, existing as individual parts; Individually distinct        "
discriminating ,"Judicious, discerning, having good judgment or insight"
disdain,Look on with contempt        
disencumber,Free from encumbrance         
disheveled,Untidy           
disingenuous,Sophisticated artful trying to deceive cunning      
disingenuous    ,"Insincere, not genuine"
disinter,Dig up from the earth       
disinterested,"Unbiased, impartial; not interested"
disjointed,"Disconnected, not coherent, jerky; having the joints separated"
dislodge,Move force from the place occupied      
dismal,Sad gloomy miserable         
dismiss,"Allow to disperse or leave; fire from a job; put aside or reject, especially after only a brief consideration"
disparage,"Belittle, put down; bring shame upon, discredit"
disparate,"Distinct, different; Essentially different          "
dispassionate,"Unbiased, not having a selfish or personal motivation; calm, lacking emotion"
dispatch,"Speed, promptness; send off or deal with in a speedy way"
disperse,"Scatter, spread widely, cause to vanish"
disposition,A person's general or natural mood; tendency
disproof,Proof to the contrary      
disquieting,"Disturbing, causing anxiety"
dissemble,"Speak or behave so as to hide smth (in mind)  ; Mislead, conceal the truth, put on a false appearance of"
disseminate,"Distribute (esp. ideas)         ; Scatter, spread about, broadcast"
dissent,"Have a different opinion refuse to assent     ; Disagree or take an opposing view, esp. in relation to a formal body such as a government, political party, or church; such a view"
dissolution,"Disintegration looseness in morals        ; Dissolving, the state of having been dissolved; breaking bonds or breaking up of a group of people; death, disintegration; sinking into extreme hedonism, vice, and degradation"
dissonance,"Harsh, inharmonious sound; cacophony; disagreement"
distaff,"Female, esp. relating to the maternal side of the family; women or women's work; a staff that holds wool or flax for spinning"
distend,"Swell, expand, stretch, bloat"
distill,Purify; extract the essential elements of
distraught,Distracted violently upset in mind       
dither,Act indecisively (verb); a state of fear or trembling excitement
diurnal,Occurring every day; happening in the daytime (rather than at night)
diverge,"Differ, deviate; branch off or turn aside, as from a path"
divergence,Getting farther apart from a point      
divest,"Deprive or strip of a rank, title, etc., or of clothing or gear; to sell off holdings (opposite of invest)"
divestiture,Taking off getting rid of giving up     
divine,Discover through divination or supernatural means; perceive by insight
divulge,Make known smth secret        
doctrinaire ,"Person who applies doctrine in an impractical or rigid and close-minded way (noun); merely theoretical, impractical, or fanatical about other people accepting one's ideas (adj)"
document ,"Support with evidence, cite sources in a detailed way, create documentary evidence of"
doff,"Take off (such as clothes), put aside; remove one's hat as a gesture"
doggerel,Trivial poorly constructed verse        
dogma,A system of principles laid down by an authority; established belief
dogmatic,Positive certain arbitrary without room for discussion     
dolt,Stupid fellow          
dormant,"Asleep, inactive, on a break; In a state of inactivity but awaiting development    "
dote,Show much fondness center one's attention      
dovetail,Join or fit together
drawl,Slow way of speaking      
droll,Jesting         ; Funny in an odd way
drone,Male bee person who isn't self-employed      
drowsiness,Feeling sleepy half asleep        
dubious,"Feeling doubt          ; Doubtful, questionable, suspect"
dud,No use person smth that fails      
dulcet,Melodious harmonious          
dupe,Cheat make a fool of       ; Person who is easily fooled or used (noun); to fool or exploit (verb)
duplicity,"Deliberate deception          ; Deceit, double-dealing, acting in two different ways for the purpose of deception"
duress,Threats to compel smb        
dwarf,Person or smb much below the usual size    
dynamo,A generator something that produces electric current     
dyspeptic,"Grumpy, pessimistic, irritable; suffering from dyspepsia (indigestion)"
e.g.,"For example, such as"
earthenware,Dishes made of baked clay       
ebullience,Exuberance outburst of feeling        
ebullient,"Overflowing with enthusiasm showing excitement       ; Very enthusiastic, lively, excited; bubbling as though being boiled"
eccentric,"Peculiar, odd, deviating from the norm esp. in a whimsical way"
echelon,"A level, rank or grade; the people at that level"
eclectic,Selecting the best of everything or from many diverse sources
eclipse,"The obscuring of one thing by another, such as the sun by the moon or a person by a more famous or talented person (noun); to obscure, darken, make less important (verb)"
ecumenical,Representing the whole christian world       
edacious,Voracious devouring          
eddy,Circular or spiral movement (e.g.. of wind)     
edible,Fit to be eaten/not poisonous     
edify,"Uplift, enlighten, instruct or improve in a spiritual or moral way"
effete,Infertile worn out weak        
efficacy,The quality of being able to produce the intended effect; Production of a desired result       
effigy,"Representation or image of a person, esp. a crude facsimile used to mock a hated person"
effluvia,Outflow in a stream of particles a noxious odor or vapor 
effrontery,Boldness impudence arrogance         
effrontery    ,Shameless boldness
egalitarian  ,"Related to belief in the equality of all people, esp. in political, economic, or social spheres"
egregious,Extraordinarily or conspicuously bad; glaring
egress,An exit or the action of exiting; Way out exit         
elaborate,Worked out with much care in great detail    
elated,"Very happy, in high spirits"
elegy,"A lament a melancholy composition       ; Song or poem of sorrow, esp. for a deceased person"
elevate,"Raise, lift up; lift the spirits of; move up to a higher rank or status or raise up to a higher spiritual or intellectual plane"
elicit,"Call forth, bring out, evoke; Draw out          "
eloquence,Fluent speaking skillful use of language      
eloquent,"Marked by forceful, fluid, apt speech; expressive, emotionally moving"
emaciate,"Make thin and weak        ; Make abnormally thin, cause to physically waste away"
embellish,"Make beautiful          ; Decorate, add ornamentation; enhance (a story) with fictional or fanciful details"
embezzle,Use in a wrong way for one's own benefit   
eminent,"Prominent, distinguished, of high rank"
emote,Stir up excite         
empirical,"Coming from, based on, or able to be verified by experience or experimentation; not purely based on theory; Relying on experiment         "
emulate,Copy in an attempt to equal or be better than
encapsulate,Enclose in capsule         
encomium,Warm or glowing praise eulogy panegyric      
encomium   ,"Warm, glowing praise, esp. a formal expression of praise"
encumbrance,Burden things that get on the way of    
endearing,Making dear or liked        
endemic,"Epidemic           ; Native, local; natural, specific to, or confined to a particular place"
endorse,Write one's name on the back of     
enduring,Lasting           
enervate,"Weaken deprive of strength attenuate       ; Weaken, tire"
engender,"Cause produce give rise to       ; Produce, give rise to, cause to exist; procreate"
engrave,Impress deeply          
engrossing,Taken up all the time or attention writing in large or formal
engulf,Swallow up          
enhance,"Raise to a higher value, desirability, etc."
enigma,"Smth that is puzzling        ; Puzzle, mystery, riddle; mysterious or contradictory person"
enmity,Hatred being an enemy        
ensign,Flag/badge         
entangle,Put into difficulties         
enthral,Please greatly/enslave (fig)       
entice,Tempt or persuade       
entitlement ,"Having the right to certain privileges; believing, sometimes without cause, that one deserves or has a right to certain privileges"
entreat,Ask earnestly          
enumerate   ,Count or list; specify one-by-one
enunciate,Pronounce (words)/express a theory      
enzyme,Catalyst           
ephemeral ,"Lasting only a short time, fleeting"
epicure,"Person with cultivated, refined tastes, esp. in food and wine"
epicurean,Devoted to pleasure (sensuous enjoyment)       
epistle,Letter           
epithet,Adjective           
epitome,Brief summary representative example a typical model     
equable,Steady regular          
equanimity,Calmness of temperament         
equanimity ,"Composure, evenness of mind; mental or emotional stability, esp. under stress"
equilibrium,State of being balanced        
equipoise,Equal distribution of weight equilibrium       
equitable,"Fair, equal, just"
equivocal,Having a double or doubtful meaning suspicious     
equivocate,Try to deceive by equivocal language      
equivocate   ,Use unclear language to deceive or avoid committing to a position
eradicate,Get rid of pull up by the roots    
erratic,"Inconsistent, wandering, having no fixed course; Irregular in behaviour or opinion       "
erroneous   ,"Mistaken, in error; improper, morally incorrect"
ersatz,"Artificial, synthetic; being an inferior substitute"
erstwhile,"Former, previous (adj); in the past, formerly (adv)"
erudite,"Scholarly, knowledgeable; possessing deep, often systematic, knowledge; Learned scholarly          "
eschew,"Shun, avoid, abstain from; Avoid         "
esoteric,Abstruse intended only for a small circle of    ; Understood by or intended for only a few; secret
espouse,Marry give one's support to       
estimable,"Worthy of esteem, admirable; able to be estimated"
ethos,"The character, personality, or moral values specific to a person, group, time period, etc."
eulogy,"Speech of praise or written work of praise, esp. a speech given at a funeral; Formal praise panegyric         "
euphemism ,"Substitution of a mild, inoffensive, or indirect expression for one that is considered offensive or too direct"
euphony,"Pleasing or sweet sound, especially as formed by a harmonious use of words"
euphoria,Elation state of pleasant excitement       
euthanasia,Easy and painless death        
evasive,Tending to evade       
evince,To show clearly to indicate       
evoke,Call up bring out        
exacerbate ,"Make worse (more violent, severe, etc.), inflame; irritate or embitter (a person)"
exacting,Very severe in making demands; requiring precise attention
excoriation,Severe criticism          
exculpate,To clear from a charge of guilt     ; Clear from guilt or blame
exhaustive,Complete thorough          
exhaustive ,"Comprehensive, thorough, exhausting a topic or subject, accounting for all possibilities; draining, tending to exhaust"
exigency,Emergency an urgent situation        
exigent,"Requiring immediate attention, action, or aid; excessively demanding"
exonerate,Clear from blame or accusation; free from a responsibility
exoneration,Set smb clear free (e.g.. from blame)     
exorbitant,Much too high or great       
expatiate,To roam wander freely        
expedient,"Suitable, proper; effective, often at the expense of ethics or other considerations; Likely to be useful for a purpose     "
expiation,Ending expiring          
explicit,"Direct, clear, fully revealed; clearly depicting sex or nudity"
exploit,Brilliant achievement develop use selfishly       
exponent,"Person who expounds or explains; champion, advocate, or representative"
expostulate,Argue earnestly to dissuade correct or protest     
expurgate,To remove obscenity purify censor       ; Censor; remove objectionable or offensive parts
exscind,To cut out cut away       
extant,Still in existence         
extemporaneous,"Done without preparation (esp. of a speech), or with some preparation but no notes; improvised, done on the spur of the moment"
extempore,Without previous thought or preparation     
extenuate,Reduce the strength of lessen seriousness partially excuse    
extinct,No longer active         
extinguish,End the existence of/wipe or put out   
extirpate,To destroy exterminate cut out exscind      
extol,Praise highly          
extort,Obtain by threats violence        
extralegal,Outside the law         
extraneous,"Irrelevant; foreign, coming from without, not belonging"
extrapolate,Conjecture about an unknown by projecting information about something known; predict by projecting past experience
extricable,That can be freed        
extrovert,Cheerful person          
exuberance,State of growing vigorously being full of life    
facetious,"Humorous funny jocular         ; Joking, humorous, esp. inappropriately; not serious, concerned with frivolous things"
facile,Easily done          
facilitate,"Make easier, help the progress of"
faction,Group or clique within a larger organization; party strife and dissension
fallacious,"Containing a fallacy, or mistake in logic; logically unsound; deceptive; Based on error         "
fallow,Left unplanted (of land); not in use
falter,Waver/move in an uncertain manner     
fanatical,"Excessively devoted, enthusiastic, or zealous in an uncritical way"
fanciful,"Whimsical, capricious; imaginary; freely imaginative rather than based on reason or reality"
fastidious,"Excessively particular, difficult to please; painstaking, meticulous, requiring excessive attention to detail"
fathom,"Measure the depth of (usually of water) as with a sounding line; penetrate and discover the meaning of, understand"
fatuous,"Foolish, silly, esp. in a smug or complacent manner; Without sense foolish self-satisfaction        "
fawn,Young deer try to win smb's favor     ; Show affection or try to please in the manner of a dog; try to win favor through flattery and submissive behavior
feasible,Possible; logical or likely; suitable
feckless,Lacking purpose or vitality ineffective careless      
fecund,"Fruitful, fertile; capable of abundantly producing offspring, vegetation, or creative or intellectual work; Fertile           "
feint,Pretend           
felicitous,"Admirably appropriate, very well-suited for the occasion; pleasant, fortunate, marked by happiness; Apt suitably expressed well chosen apropos      "
felon,Person guilty of murder        
ferment,Substance become excited         
ferocity,Savage cruelty          
ferret,Discover by searching search        
fervid,Showing earnest feeling         ; Very hot; heated in passion or enthusiasm
fervor,Warmth of feelings earnestness        
fetid,Stinking         ; Stinking; having an offensive smell
fetter,To shackle put in chains       
feud,Bitter quarrel over a long period of time    
fidelity,"Loyalty accuracy          ; Faithfulness, loyalty; strict observance of duty; accuracy in reproducing a sound or image"
fidget,Move restlessly make nervous        
figurative,"Metaphorical, based on figures of speech; containing many figures of speech (as fancy-sounding writing); related to portraying human or animal figures"
figurehead,Carved image on the prow of a ship    
finesse,"Delicate way of dealing with a situation     ; Extreme delicacy, subtlety, or diplomacy in handling a sensitive situation or in a performance or skill (noun); use tact or diplomacy; employ a deceptive strategy (verb)"
finical,Too fussy about food clothing etc.      
finicky,Finical           
fission,Splitting or division (esp. of cells)      
fixate,Stare at          
flag,"Get tired, lose enthusiasm; hang limply or droop"
flak,Criticism/anti-aircraft guns        
flamboyant,Brightly colored florid         
flaunting,Show off complacently         
flax,Pale yellow (hair) a plant       
fledged,Able to fly trained experienced       
fledgling,"A young bird that has just recently gotten its feathers, an inexperienced person (noun); new or inexperienced (adj)"
fleet,Number of ships quick-moving        
fleeting,"Passing quickly, transitory"
flinch,Draw move back wince        
flop,Fail/move/fall clumsily        
florid,"Reddish or rosy; flowery, showy, or excessively fancy; Very much ornamented naturally red (e.g.. of face)    "
flout,"Treat with disdain, contempt, or scorn (usually of rules); Reject mock to go against (as in going against tradition)  "
fluke,"Stroke of luck, something accidentally successful; Lucky stroke        "
fluster,Make nervous or confused        
foible,Defect of character (a person is wrongly proud)    
foil,Prevent from carrying out contrast       
foment,"Put smth warm (to lessen the pain)     ; Incite, instigate, stir up, promote the growth of; apply medicated liquid to a body part"
foolproof,Incapable of failure or error     
foppish,Like a man who pays too much attention to his clothes 
forage,"Wander in search of; rummage, hunt, make a raid; Food for horses and cattle     "
forbear,Refrain from be patient ancestor       
forbearance,Patience willingness to wait        
ford,Shallow place in a river (to cross)     ; Place where a river or similar body of water is shallow enough to walk or ride a vehicle across (noun); to cross at such a place (verb)
foreshadow  ,"Indicate or suggest beforehand, presage"
forestall,"Delay, hinder, prevent by taking action beforehand; Prevent by taking action in advance preempt     "
forfeit,"Suffer the loss of smth       ; Surrender or lose as a result of an error, crime, or failure to fulfill an obligation"
forge,Workshop for the shaping of metal to shape metal lead  
forgery,Counterfeit           
forswear,Renounce disallow repudiate         
fortify,"Strengthen, invigorate, encourage"
fortuitous,Happening by chance; lucky
foster,Nurture care for         
fracas,Noisy quarrel        ; Noisy disturbance or fight; brawl
fractious,"Unruly, troublemaking; irritable"
fragile,Easily injured broken or destroyed       
fragrant,Sweet-smelling           
frantic,Wildly excited with joy pain anxiety      
frenetic,"Frantic frenzied          ; Wildly excited, frantic, distracted"
fret,Worry irritation wear away        
fringe,"On the margin, periphery (adj); the people in a group who hold the most extreme views (noun); Edge ornamental border part of hair over the forehead   "
froward,Intractable not willing to yield or comply stubborn    
frugal,"Careful economical          ; Economical, thrifty, not wasteful with money; inexpensive"
fulminate,"Explode, detonate; attack verbally in a vehement, thunderous way"
fulmination,Bitter protest          
fulsome,Disgusting offensive due to excessiveness       
furtive,"Done secretly; stealthy, sly, shifty"
futile,"Producing no useful result, ineffective; trivial or unimportant"
gainsay,"To deny to oppose; Declare false, deny; oppose"
gambol,Frolic; skip or leap playfully
garble,Make unfair selection from facts     
garment,Article of clothing         
garner,"To gather and save to store up     ; Gather and store; amass, collect"
garrulity,Talkativeness           
garrulous,"Too talkative          ; Talkative, wordy, rambling"
gauche,"Tactless, lacking social grace, awkward, crude"
gaucherie,Socially awkward tactless behavior        
gawky,"Physically awkward (esp. of a tall, skinny person, often used to describe teenagers)"
germane,"Relevant and appropriate, on-topic; Relevant pertinent to         "
gestation,Pregnancy; the period from conception until birth of an animal or (metaphorically) of an idea or plan
gist,"The point general sense        ; Main idea, essence"
glacial,"Pertaining to glaciers; cold, icy, slow, unsympathetic"
glean,Gather facts in small quantities       
glib,Ready and smooth but not sincere      ; Fluent and easy in a way that suggests superficiality or insincerity
glimmer,Weak/unsteady light        
gloat,Over look at with selfish delight      
glower,"Stare in an angry, sullen way"
glut,Supply to much fill to excess      
gnaw,Waste away bite steadily        
goad,"Urge on (as cattle) with a pointed or electrically charged stick; spur on, stimulate, encourage; Smth urging a person to action      "
goosebumps,"The ""bumps"" created by hairs standing up on the skin in response to cold, fear, etc."
gorge,Eat greedily/narrow opening with a stream    
gossamer,Soft light delicate material        
gouge,"Tool for cutting grooves in wood      ; Scooping or digging tool, like a chisel, or a hole made with such a tool (noun); cut or scoop out; force out a person's eye with one's thumb; swindle, extort money from (verb)"
gradation,"A progression, a process taking place gradually, in stages; one of these stages"
graft,"Insert part of a plant into another plant, where it continues to grow; join living tissue (such as skin) to part of the body where it will continue to live and grow; attach as if by grafting (verb); the part so grafted (as in a graft of skin); the act of acquiring money or other benefits through illegal means, esp. by abusing one's power (noun)"
grandiloquent,Using pompous words       
grandiloquent ,"Relating to lofty speech, esp. to the point of being pompous, overblown, bombastic"
grandstand,Perform showily in an attempt to impress onlookers
grating,Irritating; harsh or discordant (of a noise); scraping
grave,Serious requiring consideration         
graze,Touch or scrape lightly in passing    
gregarious,"Sociable, pertaining to a flock or crowd; Living in societies liking the company      "
grievous,"Causing grief or suffering; very serious, grave; flagrant, outrageous; Causing grief or pain serious dire grave     "
grouse,Complain or grumble (verb); a reason for complaint (noun)
grovel,"Crawl humble oneself         ; Creep or crawl with one's face to the ground, prostrate oneself as a token of subservience, degrade or abase oneself"
guile,"Deceit cunning          ; Clever deceit, cunning, craftiness"
gullible,Easily gulled          
gush,Burst out suddenly/talk ardently      
gust,Outburst of feeling sudden rain wind fire etc.    
hack,Cut roughly hired horse        
hackneyed,So commonplace as to be stale; not fresh or original
halcyon,"Calm and peaceful       ; Calm and peaceful, carefree; prosperous, successful, happy"
hallmark,"A mark indicating quality, purity, genuineness, etc.; any distinguishing characteristic"
hallow,To make holy consecrate        
hand-wringing,"Grasping, squeezing, etc. of the hands as an expression of nervousness, guilt, etc.; extend debate over what to do about an issue"
hapless,"Unlucky, unfortunate"
harangue,"A long passionate speech        ; Long, intense verbal attack, esp. when delivered publicly"
harbinger,Smth or smb that foretells the coming of    
hardy,"Bold, brave, capable of withstanding hardship, fatigue, cold, etc."
harrow,Farming tool that breaks up soil (noun); painfully disturb or distress (verb); To distress create stress or torment      
haughty,Arrogant conceited          
haven,"Harbor or port; refuge, safe place"
hearken,"Listen, pay attention to"
hedge,Avoid commitment by leaving provisions for withdrawal or changing one's mind; protect a bet by also betting on the other side
hedonist,Person devoted to pleasure
heed,Attention/give notice to       
hegemony,"Domination, authority; influence by one country over others socially, culturally, economically, etc."
heinous,Odious (of crime)         
heresy,Belief contrary to what is generally accepted     
hermetic,"Airtight, sealed, isolated; reclusive; pertaining to alchemy, occult; Sealed by fusion         "
heterogeneous,Made up of different kinds       
heterogeneous  ,"Different in type, incongruous; composed of different types of elements"
hew,"Strike, chop, or hack (as with an axe, sword. etc.); make or shape something (such as a statue) with a cutting tool; Make by hard work cut (by striking)     "
hierarchy,"A ranked series; a classification of people according to rank, ability, etc.; a ruling body"
highbrow,(person) with superior tastes      
hirsute,Hairy shaggy          
hoary,"Very old, gray or white as from old age"
hoax,Mischievous trick played on smb for a joke    
hodgepodge,"Mixture of different kinds of things, jumble"
hoi,Polloi the masses the rabble       
